{
  "$schema": "http://json-schema.org/draft-07/schema#",
  "$id": "https://raw.githubusercontent.com/suirindo/agent-role-contracts/main/schemas/financial-execution.schema.json",
  "title": "Agent Role Contracts financial-execution preview",
  "type": "object",
  "additionalProperties": false,
  "required": [
    "schema_version",
    "subject_digest",
    "chain_id",
    "transaction_hash",
    "nonce",
    "block_number",
    "status",
    "executed_at",
    "observed_at"
  ],
  "properties": {
    "schema_version": {
      "type": "string",
      "const": "0.2"
    },
    "subject_digest": {
      "type": "string",
      "pattern": "^sha256:[0-9a-f]{64}$"
    },
    "chain_id": {
      "type": "string",
      "pattern": "^[1-9][0-9]*$",
      "maxLength": 78
    },
    "transaction_hash": {
      "type": "string",
      "pattern": "^0x[0-9a-fA-F]{64}$"
    },
    "nonce": {
      "type": "string",
      "pattern": "^(0|[1-9][0-9]*)$",
      "maxLength": 78
    },
    "block_number": {
      "type": "string",
      "pattern": "^(0|[1-9][0-9]*)$",
      "maxLength": 78
    },
    "status": {
      "type": "string",
      "enum": [
        "success",
        "reverted"
      ]
    },
    "executed_at": {
      "type": "string",
      "pattern": "^\\d{4}-\\d{2}-\\d{2}T\\d{2}:\\d{2}:\\d{2}(\\.\\d{3})?Z$"
    },
    "observed_at": {
      "type": "string",
      "pattern": "^\\d{4}-\\d{2}-\\d{2}T\\d{2}:\\d{2}:\\d{2}(\\.\\d{3})?Z$"
    }
  }
}
